微博id,微博正文,头条文章url,原始图片url,微博视频url,发布位置,发布时间,发布工具,点赞数,转发数,评论数
5273230265028867,《内景唐人街》（Interior Chinatown）作者Charles Yu在The Atlantic的文章，别把它称为“智能”Don’t Call It ‘Intelligence’人类是提问机器，AI 是回答机器本文改编自 Charles Yu 2026 年的 Joel Connaroe Lecture 演讲我偶尔会被一些大学邀请去做演讲，讲讲我是如何成为一名作家的。最简单 ...全文,,"https://wx1.sinaimg.cn/orj360/005RvuoQgy1iawf62l91bj31ac1l0qqg.jpg,https://wx2.sinaimg.cn/orj360/005RvuoQgy1iawf61ymxdj31ac0qbti9.jpg,https://wx3.sinaimg.cn/orj360/005RvuoQgy1iawf632pb8j31ac1haqok.jpg,https://wx3.sinaimg.cn/orj360/005RvuoQgy1iawf645d7zj31ac0nd13q.jpg,https://wx1.sinaimg.cn/orj360/005RvuoQgy1iawf64vr91j31ac1m2tv2.jpg,https://wx1.sinaimg.cn/orj360/005RvuoQgy1iawf65azzmj31ac0o848i.jpg,https://wx4.sinaimg.cn/orj360/005RvuoQgy1iawf65kt47j31ac17qql0.jpg,https://wx3.sinaimg.cn/orj360/005RvuoQgy1iawf65x0h5j31ac1o6nej.jpg,https://wx1.sinaimg.cn/orj360/005RvuoQgy1iawf666jjuj31ac1dk1a9.jpg",,,Thu Mar 05 22:05:30 +0800 2026,2023年深圳宝安马拉松 马拉松运动员  海外新鲜事博主,15,11,1
5273229738380464,明日热点前瞻：AI算力+电网设备成主线！ 今日市场呈现冲高回落走势，在外围市场带动下高开后震荡整理，全天缩量拉升、主力资金午后有所流出，最终收出小幅放量阴十字星，市场仍受消息面影响较大，明日整体走势需关注晚间欧美市场表现，结构性机会依旧是市场核心。结合最新消息与资金动向，明日重点关 ...全文,,无,,,Thu Mar 05 22:03:24 +0800 2026,微博原创视频博主,1,0,0
5273199229276193,【登上新闻联播！冯丹代表为湖北打造世界级存算一体化产业基地建言】今晚，全国人大代表、华中科技大学副校长冯丹的建议亮相《新闻联播》！她呼吁支持#湖北打造世界级存算一体化产业基地#，强调“十五五”时期数智赋能是高质量发展强大动能，湖北正加快建设，为国家在“人工智能+”新时代掌握战略主动 ...全文,,无,"https://f.video.weibocdn.com/o0/7pM4eISFlx08vPCXC3WU010412004yuf0E010.mp4?label=mp4_hd&template=852x480.25.0&ori=0&ps=1BVp4ysnknHVZu&Expires=1772728259&ssig=L5MXROq%2BYF&KID=unistore,video",,Thu Mar 05 20:02:10 +0800 2026,湖北省人民政府新闻办公室官方微博,12041,2448,159
5273229594728144,【亚马逊推出人工智能平台 自动化医疗行政流程】亚马逊旗下云业务部门 AWS 周四宣布，推出一款人工智能驱动平台，旨在改善患者就医体验，并减少医疗机构的行政工作负担。这款由自主智能体驱动的平台Amazon Connect Health可与电子病历系统集成，协助医护人员完成患者身份核验、预约挂号、整理病史、临 ...全文,,无,,,Thu Mar 05 22:02:50 +0800 2026,微博发布平台专业版,0,0,0
5273229519492551,身边的AI比想象中更早到来 #全国两会##春风习习ai上广西##春启十五五实干绽芳华# （记者 黄纪宾 陆丽丝） 广西新闻频道的微博视频 ,,无,"https://f.video.weibocdn.com/u0/oOvW59fLgx08vPLdtASY01041200q2mu0E010.mp4?label=mp4_hd&template=540x960.24.0&ori=0&ps=1BVp4ysnknHVZu&Expires=1772728259&ssig=u4jzU1UqAc&KID=unistore,video",,Thu Mar 05 22:02:32 +0800 2026,广西电视台新闻频道官方微博,0,0,0
5273214537695558,马斯克旗下的Grok人工智能好玩啊，把殖人都怼破换了，骂它是小粉红，间谍AI。在伊朗防务上，殖人瞎扯伊朗被美国轰炸很惨，是中国防空武器不行。结果GROK骂殖人瞎扯淡中国，伊朗根本就没有中国的防空导弹。又对贬低中国军力的怼回去，不听指令了。grok把西方茧房都打破了。 ,,"https://wx2.sinaimg.cn/orj360/d827c8d6gy1iavfq8z0g0j20u01vvaie.jpg,https://wx2.sinaimg.cn/orj360/d827c8d6gy1iavfrw1wxdj20z00tqq6q.jpg,https://wx1.sinaimg.cn/orj360/d827c8d6gy1iavfq31ljej20pm1a0q8l.jpg,https://wx4.sinaimg.cn/orj360/d827c8d6gy1iavfq1hi2wj20u01sxjyh.jpg,https://wx2.sinaimg.cn/orj360/d827c8d6gy1iavfq2gwmkj20u01de7ai.jpg,https://wx2.sinaimg.cn/orj360/d827c8d6gy1iavfq2qoqnj20j60simz0.jpg",,,Thu Mar 05 21:03:00 +0800 2026,柏林工业大学珠三角校友俱乐部 理事,303,31,46
5273228881691700,#代表称房地产有望成为消费新动能#【全国人大代表彭寿：房地产有望成为消费新动能】3月5日，十四届全国人大四次会议开幕。全国人大代表、中国工程院院士、中国建材集团首席科学家彭寿在人民大会堂接受包括第一财经记者在内的媒体采访时表示，房地产将会成为消费新动能，拉动新材料、人工智能、数字经济 ...全文,,无,"https://f.video.weibocdn.com/o0/O1KIBe2Hlx08vPhGOf6g010412006os60E010.mp4?label=mp4_hd&template=540x960.24.0&ori=0&ps=1BVp4ysnknHVZu&Expires=1772728259&ssig=%2F0Vy01sTCw&KID=unistore,video",,Thu Mar 05 22:00:00 +0800 2026,《中国经营报》官方微博,0,5,3
5273202751184008,李华：人工智障真不好用 ,,"https://wx4.sinaimg.cn/orj360/0072ehGVgy1iawc2zlb7nj30wq17owjh.jpg,https://wx1.sinaimg.cn/orj360/0072ehGVgy1iawc2ztws5j30wr0w1tba.jpg,https://wx3.sinaimg.cn/orj360/0072ehGVgy1iawc2z9eyfj30wr0yxq50.jpg,https://wx4.sinaimg.cn/orj360/0072ehGVgy1iawc3038d5j30wr0d575m.jpg,https://wx4.sinaimg.cn/orj360/0072ehGVgy1iawc30bhxfj30wr0hxq3z.jpg",,,Thu Mar 05 20:16:10 +0800 2026,颜值博主 微博剪辑视频博主,0,1011,1
5273228227387429,【#智能时代，全球移动通信行业如何应对三大挑战#】今年世界移动通信大会以“智能时代”为主题，象征移动通信行业正进入新的发展阶段。在不少通信行业人士看来，人工智能（AI）发展带来的数字鸿沟扩大风险、电信诈骗等安全治理问题以及监管滞后和碎片化，是移动通信行业在智能时代面临的三大挑战。会 ...全文,,https://wx3.sinaimg.cn/orj360/00221ubBgy1iawf09tww6j60p00goaj002.jpg,,,Thu Mar 05 21:57:24 +0800 2026,集成电路社区集微网官方微博,0,3,0
